{
  "$schema": "../branding.schema.json",
  "id": "relayscribe",
  "productName": "Relayscribe",
  "shortName": "Relayscribe",
  "appId": "com.agentrelay.relayscribe",
  "supportUrl": "https://agentrelay.com",
  "icon": "../assets/relayscribe/icon.svg",
  "consent": {
    "microphone": "Relayscribe captures meeting and brainstorm audio locally on your Mac. No bot joins the call.",
    "screenCapture": "Relayscribe needs screen recording access to detect active meeting windows.",
    "appleEvents": "Relayscribe uses Apple Events to identify active meeting windows."
  }
}
